NazwaDokumentu;ProduktID;Kod;ProduktNazwa;Ilosc;Jednostka;Cena;Wartosc;VAT;CenaBrutto;WartoscBrutto
FS 16455/W/2026;5681;5902605416857;BORÓWKI ŚWIEŻE BIO (około 0,125 kg);1.00;szt;10,25;10,25;5,00;10,76;10,76
FS 16455/W/2026;24396;5903794185807;BRANSOLETKA MIEDZIANA 1090 - SATTVA (AYURVEDA);1.00;szt;24,31;24,31;23,00;29,90;29,90
FS 16455/W/2026;5907;5902650274570;BROKUŁY ŚWIEŻE BIO (około 0,50 kg);2.00;szt;7,68;15,36;5,00;8,06;16,13
FS 16455/W/2026;122;4048885051430;BULION - KOSTKI WARZYWNE BEZ DODATKU DROŻDŻY BIO 8;8.00;szt;4,08;32,64;5,00;4,28;34,27
FS 16455/W/2026;3753;5907814663238;BUŁKA TARTA BIO 250 g - BIO PLANET;3.00;szt;5,55;16,65;5,00;5,83;17,48
FS 16455/W/2026;40510;5902431590431;BUŁKI DO HOT-DOGÓW BEZGLUTENOWE (2 szt.) 130 g -;4.00;szt;6,84;27,36;5,00;7,18;28,73
FS 16455/W/2026;6560;5902650272804;BURAK CZERWONY ŚWIEŻY BIO (POLSKA) (około 1,00 kg);3.00;szt;3,61;10,83;5,00;3,79;11,37
FS 16455/W/2026;6470;5902650272811;CEBULA ŻÓŁTA ŚWIEŻA BIO (POLSKA) (około 1,00 kg);1.00;szt;4,58;4,58;5,00;4,81;4,81
FS 16455/W/2026;10210;5907738152849;CHIPSY BANANOWE NIESŁODZONE BIO 350 g - BIO PLANE;2.00;szt;10,01;20,02;5,00;10,51;21,02
FS 16455/W/2026;42794;8005221301334;CHLEB TOSTOWY ORKISZOWY KROJONY BIO 400 g - IL BUO;3.00;szt;9,61;28,83;5,00;10,09;30,27
FS 16455/W/2026;32155;5907652545543;CHRUPKI PIRAMIDKI PROTEINOWE O SMAKU POMIDORA Z B;5.00;szt;3,19;15,95;5,00;3,35;16,75
FS 16455/W/2026;32155;5907652545543;CHRUPKI PIRAMIDKI PROTEINOWE O SMAKU POMIDORA Z B;5.00;szt;3,19;15,95;5,00;3,35;16,75
FS 16455/W/2026;40541;5904730218139;CHRUPKI PIRAMIDKI PROTEINOWE O SMAKU SŁODKIEJ PAPR;5.00;szt;2,89;14,45;5,00;3,03;15,17
FS 16455/W/2026;47107;5904730218627;CHRUPKI PIRAMIDKI PROTEINOWE O SMAKU SWEET THAI B;5.00;szt;3,78;18,90;5,00;3,97;19,85
FS 16455/W/2026;46857;5412916991702;CIASTECZKA OD 6 MIESIĄCA BIO 120 g - BISKIDS;2.00;szt;8,03;16,06;5,00;8,43;16,86
FS 16455/W/2026;20396;8699367125529;FARBA DO WŁOSÓW BRĄZ 4.00 - BIOMAGIC;2.00;szt;16,45;32,90;23,00;20,23;40,47
FS 16455/W/2026;20397;8699367125536;FARBA DO WŁOSÓW JASNY BRĄZ 5.00 - BIOMAGIC;3.00;szt;16,45;49,35;23,00;20,23;60,70
FS 16455/W/2026;45973;8699367121408;FARBA DO WŁOSÓW POPIELATO PERŁOWY BARDZO JASNY BL;2.00;szt;16,45;32,90;23,00;20,23;40,47
FS 16455/W/2026;7020;8713576473629;FURIKAKE (MIESZANKA SEZAMU I ALG MORSKICHTERRASANA;2.00;szt;19,47;38,94;8,00;21,03;42,06
FS 16455/W/2026;1900;8437010207815;GAZPACHO (HISZPAŃSKA ZUPA WARZYWNA) BIO 1 L - BIOS;3.00;szt;11,43;34,29;5,00;12,00;36,00
FS 16455/W/2026;17942;5907778314788;GŁOŻYNA POSPOLITA SUSZONA BIO 180 g - SOLIDA FOOD;2.00;szt;15,34;30,68;5,00;16,11;32,21
FS 16455/W/2026;10083;5902175866076;GROSZEK ZIELONY W ZALEWIE BIO350g(230g)(SŁOIKBIOPL;3.00;szt;5,85;17,55;5,00;6,14;18,43
FS 16455/W/2026;9501;5902983782247;JARMUŻ ŚWIEŻY BIO (około 0,25 kg);2.00;szt;4,80;9,60;5,00;5,04;10,08
FS 16455/W/2026;12758;5902488062899;KARCZOCH ŚWIEŻY BIO (około 0,15 kg);3.00;szt;4,53;13,59;5,00;4,76;14,27
FS 16455/W/2026;44231;8718976020831;KASZA KUSKUS PERŁOWY FREGOLA BIO 400 g - LA BIO ID;3.00;szt;9,05;27,15;5,00;9,50;28,51
FS 16455/W/2026;25604;7640104951292;KASZKA OWSIANA PEŁNOZIARNISTA BEZ DODATKU CUKRÓW P;2.00;szt;9,18;18,36;5,00;9,64;19,28
FS 16455/W/2026;7224;5907766463047;KIEŁKI BROKUŁU ŚWIEŻE BIO (około 50 g);3.00;szt;3,66;10,98;5,00;3,84;11,53
FS 16455/W/2026;45815;5907052935722;KOMBUCHA O SMAKU MALINY I LICZI ZERO % CUKRU 750;6.00;szt;18,90;113,40;23,00;23,25;139,48
FS 16455/W/2026;45816;5907052935739;KOMBUCHA O SMAKU MANGO I MARAKUI ZERO % CUKRU 750;2.00;szt;18,90;37,80;23,00;23,25;46,49
FS 16455/W/2026;41619;5905996906686;KOMBUCHA O SMAKU TRUSKAWKI I KIWI ZERO % CUKRU 75;2.00;szt;18,90;37,80;23,00;23,25;46,49
FS 16455/W/2026;47126;4751002121922;KRAKERSY Z CIECIERZYCY Z CEBULĄ BIO 80 g - KRIPPU;4.00;szt;6,29;25,16;5,00;6,60;26,42
FS 16455/W/2026;13981;4792038027079;KREM KOKOSOWY DO UBIJANIA BIO 200 g (PUSZKA) - COC;1.00;szt;6,63;6,63;8,00;7,16;7,16
FS 16455/W/2026;34804;5900652819959;LIZAK O SMAKU MALINOWYM Z WITAMINĄ D I C BEZGLUTE;40.00;szt;1,49;59,60;8,00;1,61;64,37
FS 16455/W/2026;47356;5902989935234;LIZAK O SMAKU WINOGRONO - CYTRYNA ACTIVE BEZ CUKR;40.00;szt;2,17;86,80;8,00;2,34;93,74
FS 16455/W/2026;6256;5902650272828;MARCHEW ŚWIEŻA NIEMYTA BIO (POLSKA) (około 0,90 kg;1.00;szt;4,77;4,77;5,00;5,01;5,01
FS 16455/W/2026;4224;5907814664822;MĄKA ORKISZOWA RAZOWA TYP 2000 BIO 1 kg BIO PLANET;5.00;szt;8,25;41,25;5,00;8,66;43,31
FS 16455/W/2026;4224;5907814664822;MĄKA ORKISZOWA RAZOWA TYP 2000 BIO 1 kg BIO PLANET;5.00;szt;8,25;41,25;5,00;8,66;43,31
FS 16455/W/2026;34932;7640161877351;MUS SILNA PAPUGA (GRUSZKA - JABŁKO - SZPINAK) BEZ;5.00;szt;3,87;19,35;5,00;4,06;20,32
FS 16455/W/2026;46504;7640230493819;MUS SŁODKI LENIWIEC (BATAT - ŚLIWKA - DYNIA - TRU;4.00;szt;4,29;17,16;5,00;4,50;18,02
FS 16455/W/2026;46507;7640230493666;MUS TAŃCZĄCY DINOZAUR JABŁKO Z BORÓWKAMI I ŚLIWKĄ;5.00;szt;3,95;19,75;5,00;4,15;20,74
FS 16455/W/2026;2624;4038375024396;NAPÓJ OWSIANY BEZ DODATKU CUKRÓW BIO 1 L - NATUMI;4.00;szt;5,78;23,12;5,00;6,07;24,28
FS 16455/W/2026;25652;8019428000013;NAPÓJ RYŻOWY BEZ DODATKU CUKRÓW BEZGLUTENOWY BIO 1;3.00;szt;6,72;20,16;5,00;7,06;21,17
FS 16455/W/2026;45017;59099109;NATURALNA WODA MINERALNA NISKOGAZOWANA 1 L - MILA;36.00;szt;5,31;191,16;23,00;6,53;235,13
FS 16455/W/2026;5974;5907814661470;OGÓREK DŁUGI ŚWIEŻY BIO (około 0,35 kg);2.00;szt;7,74;15,48;5,00;8,13;16,25
FS 16455/W/2026;1792;8029689004217;OLIWKI CZARNE BEZ PESTEK W ZALEWIE BIO 280 g (150;2.00;szt;8,71;17,42;5,00;9,15;18,29
FS 16455/W/2026;1791;8029689003999;OLIWKI ZIELONE BEZ PESTEK W ZALEWIE BIO 280 g (150;2.00;szt;8,71;17,42;5,00;9,15;18,29
FS 16455/W/2026;44993;5904538034351;OWOCOWE DODATKI DO MUSLI I DESERÓW JUNIOR BIO 20 g;4.00;szt;7,78;31,12;5,00;8,17;32,68
FS 16455/W/2026;44997;5904538034368;OWOCOWE DODATKI DO MUSLI I DESERÓW NATURALNE PIĘKN;3.00;szt;6,33;18,99;5,00;6,65;19,94
FS 16455/W/2026;26855;5902367404840;PALUSZKI GRISSINI Z OLEJEM SŁONECZ. 125g-VITALIAN;6.00;szt;2,98;17,88;5,00;3,13;18,77
FS 16455/W/2026;26854;5902367404888;PALUSZKI GRISSINI Z POMI. I BAZYLIĄ 125g-VITALIAN;6.00;szt;2,98;17,88;5,00;3,13;18,77
FS 16455/W/2026;6077;5998858706562;PALUSZKI LEKKO SOLONE BEZGLUTENOWE BIO 45 g - BIOP;6.00;szt;3,27;19,62;5,00;3,43;20,60
FS 16455/W/2026;15002;5902650274624;PAPRYKA DŁUGA ŚWIEŻA BIO (około 0,60 kg);1.00;szt;16,39;16,39;5,00;17,21;17,21
FS 16455/W/2026;22994;5902650275676;PESTKI DYNI JASNE BIO 1 kg - BIO PLANET;1.00;szt;26,25;26,25;5,00;27,56;27,56
FS 16455/W/2026;4715;8009004850224;PESTO Z CUKINII BIO 130 g - ALCE NERO;3.00;szt;8,20;24,60;8,00;8,86;26,57
FS 16455/W/2026;46398;5908231224033;PIEROGI Z KURCZAKIEM BEZGLUTENOWE 280 g - BEZGLUT;1.00;szt;20,49;20,49;5,00;21,51;21,51
FS 16455/W/2026;44578;5907745970078;PIEROGI Z MIĘSEM BEZGLUTENOWE 280 g - BEZGLUTENOV;1.00;szt;20,23;20,23;5,00;21,24;21,24
FS 16455/W/2026;9711;4019555705496;PŁYN DO MYCIA OWOCÓW I WARZYW ECO 500 ml - ALMAWIN;2.00;szt;10,58;21,16;23,00;13,01;26,03
FS 16455/W/2026;47248;5902983784906;POMIDORY KOKTAJLOWE MIX ŚWIEŻE BIO (około 0,25 kg);2.00;szt;7,84;15,68;5,00;8,23;16,46
FS 16455/W/2026;6038;253721;POMIDORY NA GAŁĄZCE ŚWIEŻE BIO (około 0,45 kg);1.036;kg;16,29;16,88;5,00;17,10;17,72
FS 16455/W/2026;22400;5903900368070;POMIDORY SUSZONE W OLEJU BIO 280 g - BIO PLANET;2.00;szt;11,63;23,26;5,00;12,21;24,42
FS 16455/W/2026;2785;5907814664907;POPCORN (ZIARNO KUKURYDZY) BIO 400 g - BIO PLANET;3.00;szt;5,03;15,09;5,00;5,28;15,84
FS 16455/W/2026;13670;5904730218894;POPCORN Z NIEBIESKIEJ KUKURYDZY Z SHEA I SOLĄ DO P;4.00;szt;4,51;18,04;5,00;4,74;18,94
FS 16455/W/2026;2150;5902448163727;SAŁATA LODOWA ŚWIEŻA BIO (około 0,30 kg);1.00;szt;10,21;10,21;5,00;10,72;10,72
FS 16455/W/2026;1933;4850001113591;SOK Z ROKITNIKA NFC BIO 250 ml - YAN;3.00;szt;6,84;20,52;5,00;7,18;21,55
FS 16455/W/2026;2757;5907814662705;ŚLIWKI KALIFORNIJSKIE GF BIO 400 g- BIO PLANET;1.00;szt;22,05;22,05;5,00;23,15;23,15
FS 16455/W/2026;11783;5904730012669;TALARKI JAGLANO-KUKURYDZIANE BIO 55 g - BIOMINKI;6.00;szt;3,23;19,38;5,00;3,39;20,35
FS 16455/W/2026;5598;8002885007558;WAFLE Z SORGO I AMARANTUSA BEZGLUTENOWE BIO 120 g;3.00;szt;5,95;17,85;5,00;6,25;18,74
FS 16455/W/2026;3253;5907814668141;WŁOSZCZYZNA ŚWIEŻA BIO (POLSKA) (około 0,60 kg);1.00;szt;7,82;7,82;5,00;8,21;8,21
FS 16455/W/2026;25564;5907784827227;WODA JAVA ALKALICZNA NIEGAZOWANA 860 ml - WODY KA;6.00;szt;5,02;30,12;23,00;6,17;37,05
FS 16455/W/2026;19844;5900238562866;WODA ŹRÓDLANA NIEGAZOWANA 700 ml (SZKŁO) - BABY ZD;30.00;szt;5,06;151,80;23,00;6,22;186,71
FS 16455/W/2026;19844;5900238562866;WODA ŹRÓDLANA NIEGAZOWANA 700 ml (SZKŁO) - BABY ZD;6.00;szt;5,06;30,36;23,00;6,22;37,34
FS 16455/W/2026;30708;5902537543324;ZAKWAS Z BURAKÓW KISZONYCH NIEPASTERYZOWANY BEZGL;2.00;szt;11,31;22,62;5,00;11,88;23,75
