NazwaDokumentu;ProduktID;Kod;ProduktNazwa;Ilosc;Jednostka;Cena;Wartosc;VAT;CenaBrutto;WartoscBrutto
FS 419/W/2026;40525;5902425050545;SYROP DAKTYLOWY BIO 350 g -  NATURAVENA;4.00;szt;9,35;37,40;8,00;10,10;40,39
FS 419/W/2026;44662;5902693122777;SYROP Z KWIATÓW CZARNEGO BZU BEZGLUTENOWY BIO 500;4.00;szt;8,71;34,84;8,00;9,41;37,63
FS 419/W/2026;3513;5902605410589;SZPINAK BABY ŚWIEŻY NIEMYTY BIO (około 0,10 kg);1.00;szt;5,07;5,07;5,00;5,32;5,32
FS 419/W/2026;9176;4044889004595;TABLICZKA KAKAOWA BIO 80 g - ICHOC (VIVANI);2.00;szt;8,67;17,34;23,00;10,66;21,33
FS 419/W/2026;11782;5904730012683;TALARKI GRYCZANE BIO 55 g - BIOMINKI;5.00;szt;3,36;16,80;5,00;3,53;17,64
FS 419/W/2026;10234;5907738152870;TAPIOKA (SKROBIA Z MANIOKU) BEZGLUTENOWA BIO 800 g;5.00;szt;7,50;37,50;5,00;7,88;39,38
FS 419/W/2026;10234;5907738152870;TAPIOKA (SKROBIA Z MANIOKU) BEZGLUTENOWA BIO 800 g;5.00;szt;7,50;37,50;5,00;7,88;39,38
FS 419/W/2026;19092;5903453003633;WAFLE DOMOWE NATURALNE BEZ DODATKU CUKRÓW BIO 19;5.00;szt;8,33;41,65;5,00;8,75;43,73
FS 419/W/2026;7285;8002885003390;WAFLE KUKURYDZIANE BEZGLUTENOWE BIO 120 gIORENTINI;5.00;szt;4,00;20,00;5,00;4,20;21,00
FS 419/W/2026;43238;5902609001400;WAFLE Z CIECIERZYCY BEZGLUTENOWE 135 g - LESTELLO;6.00;szt;3,74;22,44;5,00;3,93;23,56
FS 419/W/2026;10070;5902488060062;WIÓRKI KOKOSOWE BEZGLUTENOWE BIO 1 kg - BIO PLANET;1.00;szt;30,00;30,00;5,00;31,50;31,50
FS 419/W/2026;303;5902175869961;WIÓRKI KOKOSOWE BEZGLUTENOWE BIO 500 g - IO PLANET;2.00;szt;15,75;31,50;5,00;16,54;33,08
FS 419/W/2026;10446;5900238562354;WODA ŹRÓDLANA NIEGAZOWANA GIRL 250 ml - BABY ZDRÓJ;12.00;szt;1,83;21,96;23,00;2,25;27,01
FS 419/W/2026;32476;5905567011108;YERBA MATE GREEN BIO 200 g - ORGANIC MATE GREEN;2.00;szt;12,58;25,16;23,00;15,47;30,95
FS 419/W/2026;7728;5902768527896;ZIELE ANGIELSKIE BIO 50 g - DARY NATURY;2.00;szt;9,73;19,46;8,00;10,51;21,02
FS 419/W/2026;17730;4055297150002;ŻEL POD PRYSZNIC ANANAS I CYTRYNA ECO 500 ml - SAN;2.00;szt;20,27;40,54;23,00;24,93;49,86
FS 419/W/2026;18626;5900900003376;ŻYWY ZAKWAS Z BURAKÓW BEZGLU BIO 320ml- KOWALEWSKI;12.00;szt;4,29;51,48;5,00;4,50;54,05
