NazwaDokumentu;ProduktID;Kod;ProduktNazwa;Ilosc;Jednostka;Cena;Wartosc;VAT;CenaBrutto;WartoscBrutto
FS 5822/W/2026;17988;5907222061770;AMARANTUS EKSPANDOWANY BIO 100 g - HELPA;2.00;szt;9,05;18,10;5,00;9,50;19,01
FS 5822/W/2026;27820;5906750252490;BABCIANKI OWSIANE BEZ DODATKU CUKRÓW 100g-NATURAV;6.00;szt;3,70;22,20;5,00;3,89;23,31
FS 5822/W/2026;45810;5902448291499;BŁONNIK GREENS & JUICE CYTRYNOWY 360 g - SO GOOD!;1.00;szt;28,31;28,31;8,00;30,57;30,57
FS 5822/W/2026;5907;5902650274570;BROKUŁY ŚWIEŻE BIO (około 0,50 kg);2.00;szt;7,66;15,32;5,00;8,04;16,09
FS 5822/W/2026;43460;5907653106453;BUŁKI DO HOT DOGÓW BEZGLUTENOWE (4 szt.) 260 g -;3.00;szt;5,95;17,85;5,00;6,25;18,74
FS 5822/W/2026;40510;5902431590431;BUŁKI DO HOT-DOGÓW BEZGLUTENOWE (2 szt.) 130 g -;4.00;szt;5,78;23,12;5,00;6,07;24,28
FS 5822/W/2026;40511;5902431590738;BUŁKI KAJZERKI BEZGLUTENOWE 120 g - INCOLA;3.00;szt;6,80;20,40;5,00;7,14;21,42
FS 5822/W/2026;7351;255069;CEBULA CZERWONA ŚWIEŻA BIO (POLSKA) (około 1,00 kg;9.535;kg;6,04;57,59;5,00;6,34;60,47
FS 5822/W/2026;6470;5902650272811;CEBULA ŻÓŁTA ŚWIEŻA BIO (POLSKA) (około 1,00 kg);10.00;szt;4,10;41,00;5,00;4,31;43,05
FS 5822/W/2026;3936;8718754502313;CHIPSY ZIEMNIACZANE O SMAKU ŚMIETANKOWO - CEBULOWY;3.00;szt;6,55;19,65;5,00;6,88;20,63
FS 5822/W/2026;27910;5902367401542;CHLEB JASNY KROJONY BEZGLUTENOWY 200g-NATURAVEN;6.00;szt;6,16;36,96;5,00;6,47;38,81
FS 5822/W/2026;30938;5900028007768;CHRUPKI KUKURYDZIANE MISIE BIO 80 g - GRANEX;4.00;szt;5,14;20,56;5,00;5,40;21,59
FS 5822/W/2026;30939;5900028008536;CHRUPKI KUKURYDZIANO - JAGLANE DELFINKI BIO 80 g;4.00;szt;5,14;20,56;5,00;5,40;21,59
FS 5822/W/2026;46940;4262367684569;CHRUPKI KUKURYDZIANO - WARZYWNE OD 1 ROKU BIO 30;3.00;szt;5,65;16,95;5,00;5,93;17,80
FS 5822/W/2026;32156;5904730218344;CHRUPKI PIRAMIDKI PROTEINOWE O SMAKU SERA I CEBULI;5.00;szt;3,49;17,45;5,00;3,66;18,32
FS 5822/W/2026;6156;8717496900142;CIECIERZYCA W ZALEWIE BIO 400 g (240 g) (PUSZKA) -;3.00;szt;4,42;13,26;5,00;4,64;13,92
FS 5822/W/2026;248;5902983785644;CUKIER TRZCINOWY JASNY BIO 500 g - BIO PLANET;3.00;szt;5,10;15,30;8,00;5,51;16,52
FS 5822/W/2026;14880;5411788046503;CYKORIA DO ZAPARZANIA BIO 250 g – LIMA;2.00;szt;10,97;21,94;8,00;11,85;23,70
FS 5822/W/2026;2830;5907814665300;FASOLKA BIAŁA BIO 400 g - BIO PLANET;3.00;szt;6,98;20,94;5,00;7,33;21,99
FS 5822/W/2026;10112;5902488067399;FASOLKA W SOSIE POMIDOROWYM BIO 360 g - BIO PLANE;3.00;szt;5,63;16,89;5,00;5,91;17,73
FS 5822/W/2026;1900;8437010207815;GAZPACHO (HISZPAŃSKA ZUPA WARZYWNA) BIO 1 L - BIOS;2.00;szt;11,43;22,86;5,00;12,00;24,00
FS 5822/W/2026;23038;4000915103410;GNOCCHI ŚWIEŻE BIO 400 g - BIO-VERDE;2.00;szt;11,26;22,52;5,00;11,82;23,65
FS 5822/W/2026;9863;5902706730791;GRAVIOLA EKSTRAKT (550 mg) 60 KAPSUŁEK - SOUL FARM;5.00;szt;23,76;118,80;8,00;25,66;128,30
FS 5822/W/2026;11972;5903900368650;JABŁKA ŚWIEŻE BIO (GALA - POLSKA) (około 1,00 kg);2.00;szt;6,84;13,68;5,00;7,18;14,36
FS 5822/W/2026;9501;5902983782247;JARMUŻ ŚWIEŻY BIO (około 0,25 kg);2.00;szt;5,08;10,16;5,00;5,33;10,67
FS 5822/W/2026;6134;5907814662392;KALAFIOR ŚWIEŻY BIO (około 0,70 kg);1.00;szt;10,69;10,69;5,00;11,22;11,22
FS 5822/W/2026;27538;5902367407803;KASZA BULGUR BIO 500 g - NATURAVENA;6.00;szt;6,38;38,28;5,00;6,70;40,19
FS 5822/W/2026;27568;5908445474941;KASZA GRYCZANA PALONA BIO 1 kg - NATURAVENA;3.00;szt;10,63;31,89;5,00;11,16;33,48
FS 5822/W/2026;2790;5907814664808;KASZA JAGLANA BEZGLUTENOWA BIO 400 g - BIO PLANET;6.00;szt;2,10;12,60;5,00;2,21;13,23
FS 5822/W/2026;8402;5907738152504;KASZA JAGLANA BIO (POLSKA) 1 kg - BIO RAJ;2.00;szt;8,33;16,66;5,00;8,75;17,49
FS 5822/W/2026;27547;5906750251394;KASZA MANNA BIO 400 g - NATURAVENA;4.00;szt;5,40;21,60;5,00;5,67;22,68
FS 5822/W/2026;20685;5903900366373;KASZKA JAGLANA BEZ DODATKU CUKRÓW BIO 200 g - BIOM;3.00;szt;6,38;19,14;5,00;6,70;20,10
FS 5822/W/2026;46640;5903853400230;KASZKA KUKURYDZIANA BEZ DODATKU CUKRÓW BIO 200 g;4.00;szt;4,29;17,16;5,00;4,50;18,02
FS 5822/W/2026;8149;4000799109447;KAWA ZBOŻOWA ORKISZOWA DEMETER BIO 100 g - MOUNT H;2.00;szt;12,41;24,82;8,00;13,40;26,81
FS 5822/W/2026;6174;8717496907097;KONCENTRAT POMIDOROWY 22% BIO 70 g - LA BIO IDEA;5.00;szt;3,61;18,05;5,00;3,79;18,95
FS 5822/W/2026;35406;5904954645445;KÓŁKA ZBOŻOWE MIODOWE BEZGLUTENOWE 375 g - JERRY G;2.00;szt;9,01;18,02;5,00;9,46;18,92
FS 5822/W/2026;34168;5060691233441;MAKARON (KONJAC) GOTOWY NA WOKA BEZGLUTENOWY BIO 2;5.00;szt;4,00;20,00;5,00;4,20;21,00
FS 5822/W/2026;30968;5060691233540;MAKARON (KONJAC) PAPPARDELLE BEZGLUTENOWY BIO 270;5.00;szt;4,00;20,00;5,00;4,20;21,00
FS 5822/W/2026;43040;5060691233519;MAKARON (KONJAC) PENNE BEZGLUTENOWY BIO 270 g (200;5.00;szt;3,74;18,70;5,00;3,93;19,64
FS 5822/W/2026;30970;5060691233557;MAKARON (KONJAC) UDON BEZGLUTENOWY BIO 270 g (200;5.00;szt;4,00;20,00;5,00;4,20;21,00
FS 5822/W/2026;2950;8009004120129;MAKARON (Z PŁASKURKI) ŚWIDERKI IO 500 g - ALCE NER;2.00;szt;11,14;22,28;5,00;11,70;23,39
FS 5822/W/2026;12144;8009004810600;MAKARON PŁASKURK GWIAZD B1 DZIECI 6m BIO 500g ALCE;2.00;szt;13,35;26,70;5,00;14,02;28,04
FS 5822/W/2026;13107;5902488064268;MANGO ATAULFO ŚWIEŻE BIO (około 0,18 kg);1.00;szt;9,62;9,62;5,00;10,10;10,10
FS 5822/W/2026;6256;5902650272828;MARCHEW ŚWIEŻA NIEMYTA BIO (POLSKA) (około 0,90 kg;1.00;szt;4,77;4,77;5,00;5,01;5,01
FS 5822/W/2026;345;5907814661074;MĄKA AMARANTUSOWA BIO 400 g - BIO PLANET;2.00;szt;7,65;15,30;5,00;8,03;16,07
FS 5822/W/2026;350;5902983781233;MĄKA JAGLANA BIO 1 kg - BIO PLANET;2.00;szt;7,65;15,30;5,00;8,03;16,07
FS 5822/W/2026;314;5902175869985;MĄKA Z PSZENICY DURUM (SEMOLINA) BIO 500g-BIO PLAN;4.00;szt;4,58;18,32;5,00;4,81;19,24
FS 5822/W/2026;32119;7640230491938;MLEKO KOZIE 4 OD 1 ROKU ŻYCIA BIO 400 g - HOLLE;1.00;szt;42,12;42,12;5,00;44,23;44,23
FS 5822/W/2026;30173;7640161877085;MUS BRZOSKWINIOWA PANDA (BRZOSKWINIA - BANAN - MOR;5.00;szt;3,87;19,35;5,00;4,06;20,32
FS 5822/W/2026;6824;5907814667045;MUSLI ORZECHOWE BIO 600 g - BIO PLANET;2.00;szt;9,75;19,50;5,00;10,24;20,48
FS 5822/W/2026;35404;5904954645438;MUSZELKI ZBOŻOWE CYNAMONOWE BEZGLUTENOWE 375 g -;2.00;szt;9,52;19,04;5,00;10,00;19,99
FS 5822/W/2026;31066;5907784827401;NATURAL WODA MINER ŚRED LEKKO GAZ 860ml(SZKŁ)-JAVA;4.00;szt;5,02;20,08;23,00;6,17;24,70
FS 5822/W/2026;31373;7640161878976;NATURALNA WODA MINERALNA NIEGAZOWANA DLA NIEMOWLĄT;6.00;szt;3,15;18,90;23,00;3,87;23,25
FS 5822/W/2026;33189;5907707433559;OCET MALINOWY ŻYWY 330 ml - PROSTO ZE WSI;1.00;szt;17,85;17,85;23,00;21,96;21,96
FS 5822/W/2026;16015;5907722373267;OLEJ SEZAMOWY TŁOCZONY NA ZIMNO BIO 250 ml - BIOOI;1.00;szt;16,79;16,79;5,00;17,63;17,63
FS 5822/W/2026;42291;8031301141262;OLEJ Z PESTEK DYNI TŁOCZONY NA ZIMNO BIO 250 ml -;1.00;szt;20,57;20,57;5,00;21,60;21,60
FS 5822/W/2026;43318;5906293639673;OLEJEK ETERYCZNY WANILIA 10 ml - YOUR CANDLE;2.00;szt;14,84;29,68;23,00;18,25;36,51
FS 5822/W/2026;32462;7640161878952;OLIWA Z OLIWEK EXTRA VIRGIN DEMETER BIO 250 ml -;1.00;szt;28,22;28,22;5,00;29,63;29,63
FS 5822/W/2026;6078;5998858706579;PALUSZKI SOLONE BEZGLUTENOWE BIO 45 g - BIOPONT;6.00;szt;3,27;19,62;5,00;3,43;20,60
FS 5822/W/2026;44480;3800501908587;PASTA DO ZĘBÓW REMINERALIZUJĄCA SENSITIVE Z PŁYNN;3.00;szt;5,87;17,61;23,00;7,22;21,66
FS 5822/W/2026;47453;9416050575916;PASTYLKI DO SSANIA MGO 570 + UMF 16 + 22 g - HADD;2.00;szt;21,38;42,76;8,00;23,09;46,18
FS 5822/W/2026;6770;8718976016285;PIADINA ORKISZOWA BIO (4 szt.) 260 g - LA BIO IDEA;2.00;szt;11,22;22,44;5,00;11,78;23,56
FS 5822/W/2026;12297;5902581618474;PIEPRZ KOLOROWY ZIARNO (UZUPEŁNIENIE) BIO 160 g -;1.00;szt;26,82;26,82;8,00;28,97;28,97
FS 5822/W/2026;44578;5907745970078;PIEROGI Z MIĘSEM BEZGLUTENOWE 280 g - BEZGLUTENOV;4.00;szt;20,23;80,92;5,00;21,24;84,97
FS 5822/W/2026;34382;5907518375369;PIEROGI Z SEREM I RODZYNKAMI BEZGLUTENOWE 275 g -;1.00;szt;17,34;17,34;5,00;18,21;18,21
FS 5822/W/2026;31093;5907518375376;PIEROGI Z TRUSKAWKAMI 275 g - MAMA VEGE;2.00;szt;14,20;28,40;5,00;14,91;29,82
FS 5822/W/2026;10172;5902983789499;PŁATKI MIGDAŁOWE BIO 300 g - BIO PLANET;1.00;szt;19,50;19,50;5,00;20,48;20,48
FS 5822/W/2026;2345;4779030680235;PODPASKI HIGIENICZNE MINI Z PASKIEM ANIONENTLE DAY;2.00;szt;9,01;18,02;5,00;9,46;18,92
FS 5822/W/2026;18276;8032738360806;PODPASKI HIGIENICZNE ZE SKRZYDEŁKAMI NA DZIEŃ ECO;2.00;szt;9,14;18,28;5,00;9,60;19,19
FS 5822/W/2026;46556;7640230493178;PRECELKI ORKISZOWE CYFERKI DLA DZIECI BIO 80 g -;3.00;szt;1,45;4,35;5,00;1,52;4,57
FS 5822/W/2026;18456;5907738159473;QUINOA BIAŁA (KOMOSA RYŻOWA) BEZGLUTEN BIO 250BGOL;3.00;szt;6,93;20,79;5,00;7,28;21,83
FS 5822/W/2026;23245;5902650275799;RYŻ BASMATI PEŁNOZIARNISTY BIO 2 kg - BIO PLANET;1.00;szt;22,50;22,50;5,00;23,63;23,63
FS 5822/W/2026;10118;5903900365918;RYŻ BIAŁY DŁUGOZIAR. BEZGL. BIO 1 kg - BIO PLANET;3.00;szt;9,75;29,25;5,00;10,24;30,71
FS 5822/W/2026;7996;5907814661999;SELER NACIOWY ŚWIEŻY BIO (około 0,30 kg);2.00;szt;5,79;11,58;5,00;6,08;12,16
FS 5822/W/2026;4942;5907814666468;SOCZEWICA CZERWONA BIO 1 kg - BIO PLANET;2.00;szt;12,75;25,50;5,00;13,39;26,78
FS 5822/W/2026;5804;4019555100307;SÓL DO ZMYWAREK ECO 2 kg - KLAR;2.00;szt;9,95;19,90;23,00;12,24;24,48
FS 5822/W/2026;11783;5904730012669;TALARKI JAGLANO-KUKURYDZIANE BIO 55 g - BIOMINKI;6.00;szt;3,23;19,38;5,00;3,39;20,35
FS 5822/W/2026;5598;8002885007558;WAFLE Z SORGO I AMARANTUSA BEZGLUTENOWE BIO 120 g;3.00;szt;5,95;17,85;5,00;6,25;18,74
FS 5822/W/2026;18282;8032738361216;WKŁADKI HIGIENICZNE ECO 35 szt. - VIVICOT;6.00;szt;11,22;67,32;5,00;11,78;70,69
FS 5822/W/2026;25564;5907784827227;WODA JAVA ALKALICZNA NIEGAZOWANA 860 ml - WODY KA;8.00;szt;5,02;40,16;23,00;6,17;49,40
FS 5822/W/2026;23490;5900238562682;WODA ŹRÓDLANA NIEGAZOWANA NISKOSODOWA 330 ml (SZK;12.00;szt;2,13;25,56;23,00;2,62;31,44
