NazwaDokumentu;ProduktID;Kod;ProduktNazwa;Ilosc;Jednostka;Cena;Wartosc;VAT;CenaBrutto;WartoscBrutto
KFS 46495/W/2025;25322;5906732620606;BARSZCZ CZERWONY BEZGLUTENOWY 830 ml - KROKUS;-2.00;szt;13,22;-26,44;5,00;13,88;-27,76
KFS 46495/W/2025;3934;8718754501972;CHIPSY WARZYWNE PIECZONE BIO 75 g - T;-1.00;szt;8,42;-8,42;5,00;8,84;-8,84
KFS 46495/W/2025;3937;8718754502078;CHIPSY ZIEMNIACZANE NATURALNE BEZ DODATKUg - TRAFO;-1.00;szt;6,97;-6,97;5,00;7,32;-7,32
KFS 46495/W/2025;33603;8718754506687;CHIPSY ZIEMNIACZANE O SMAKU CZARNEJ TRUFLI BIO 10;-1.00;szt;10,63;-10,63;5,00;11,16;-11,16
KFS 46495/W/2025;27903;5900038002401;CUKIER WANILINOWY BEZGLUTENOWY 32 g - CELIKO;-30.00;szt;0,68;-20,40;8,00;0,73;-22,03
KFS 46495/W/2025;8028;4018722100133;MAKARON (ORKISZOWY JAJECZNY) NITKI BIO 25 ALB GOLD;-3.00;szt;6,38;-19,14;5,00;6,70;-20,10
